<rtml xmlns:xsi="http://www.w3.org/2001/XMLSchema-instance" 
      xsi:noNamespaceSchemaLocation="https://raw.githubusercontent.com/afuentesan/xmltui/refs/heads/main/schema.xsd"
>
    <head>
        <style>
            ".red" : {
                "fg" : "#ff0000"
            },
            "p:focus" : {
                "bg" : "#113311"
            },
            "layout" : {
                "dir" : "horizontal"
            },
            "line" : { "length" : 12, "padding-left" : 4 },
            "input" : { "align" : "left" }
        </style>
        <template name="definicion">
            <p class="p" padding="1">{{ ctx }}</p>
        </template>
        <code command="/usr/bin/bash" name="buscar">
            <envs>
                <st-env name="palabra" />
            </envs>
            <args>
                <arg>-c</arg>
                <arg>
                    <![CDATA[ 
                        curl -s "https://rae-api.com/api/words/${palabra}" |jq -r ".data.meanings[].senses[].raw" 2>> /tmp/err_rt

                        exit 0
                    ]]>
                </arg>
            </args>
        </code>

        <template name="border-bg">
            {% if st.palabra | trim == "culo" %}
                Red
            {% else %}
                Green
            {% endif %}
        </template>

        <template name="border-title-bg">
            {% if st.palabra | trim == "culo" %}
                Blue
            {% else %}
                Yellow
            {% endif %}
        </template>

    </head>
    <body dir="horizontal" flex="center" padding="1">
        <border 
            title="Diccionario" 
            dir="vertical" 
            max="60" 
            flex="start" 
            fg-border="{{ 'Blue' if st.palabra | trim == 'culo' else 'Yellow' }}" 
            fg-title="{{ 'Yellow' if st.palabra | trim == 'culo' else 'Blue' }}" 
            padding-top="1" 
            bg-template="border-bg" 
            bg-title-template="border-title-bg"
        >
            <layout flex="center" length="2" padding-bottom="1">
                <line>Buscar:</line>
                <input id="palabra" enter="buscar" enter-envs="palabra" enter-replace-childs="definicion" enter-template="definicion" />
            </layout>
            <layout id="definicion" flex="center" dir="vertical">

            </layout>
        </border>
    </body>
</rtml>