<rtml xmlns:xsi="http://www.w3.org/2001/XMLSchema-instance" 
      xsi:noNamespaceSchemaLocation="https://raw.githubusercontent.com/afuentesan/xmltui/refs/heads/main/schema.xsd"
>
    <head>
        <style>
            {
                ".red" : {
                    "fg" : "#bb2222"
                },
                "input, select" : {
                    "bg" : "#333333",
                    "fill" : "1",
                    "align" : "center",
                    "padding-top" : 3,
                    "padding-left" : "2",
                    "flex" : "space-between",
                    "dir" : "vertical"
                },
                "layout" : {
                    "dir" : "horizontal",
                    "flex" : "center"
                },
                "line" : {
                    "align" : "center"
                }
            }
        </style>
        <code command="/usr/bin/node" name="actions">
            <args>
                <arg>-e</arg>
                <arg>
                    <![CDATA[ 
                        const options = {
                            options : [
                                {
                                    value : "new_partial",
                                    text : "Agregar <span class='red'>parciales</span>"
                                },
                                {
                                    value : "new_fx",
                                    text : "Agregar <span class='red'>efectos</span>"
                                },
                                {
                                    value : "new_fx",
                                    text : "Agregar 2 <span class='red'>efectos</span>"
                                },
                                {
                                    value : "new_fx",
                                    text : "Agregar 3 <span class='red'>efectos</span>"
                                },
                                {
                                    value : "new_fx",
                                    text : "Agregar 4 <span class='red'>efectos</span>"
                                },
                                {
                                    value : "new_fx",
                                    text : "Agregar 5 <span class='red'>efectos</span>"
                                },
                                {
                                    value : "new_fx",
                                    text : "Agregar 6 <span class='red'>efectos</span>"
                                }
                            ]
                        };

                        console.log( JSON.stringify( options ) );
                    ]]>
                </arg>
            </args>
        </code>
    </head>

    <state>
        <st-var path="/count" value="0" type="number" />
        <st-command path="/actions" exec="actions" output="json" envs="count:/count" args="count:/count" on-init="true" />
    </state>

    <body dir="vertical" flex="center">

        <command output="json" exec="actions" dir="horizontal" flex="center" length="15">
            <template>
                <select length="25" padding="1" dropdown="false" align="center" id="opcion" enter-src="{% raw %}{{ st.opcion }}{% endraw %}" set-focus="true">
                    {% for option in ctx.options %}
                        <option value="{{ option.value }}">{{ option.text }}</option>
                    {% endfor %}
                </select>
            </template>
        </command>

        <layout class="prueba" bg="#001100">
            <line>Hola <span bg="{{ 'Red' }}">Red</span></line>
        </layout>
    </body>
</rtml>